{
  "boundary": {
    "advisory": true,
    "claimLimitations": [
      "Hardware-originated references are hints until reconciled by normal indexer, receipt, and verifier paths.",
      "LoRa and Meshtastic packets carry compact control signals, not artifacts, model data, media, or raw memory.",
      "NFC cartridge metadata is an untrusted pointer until checked against expected commitments.",
      "Emergency offline signals are operator alerts or challenge inputs only; they do not execute remote actions.",
      "Bridge alerts are operator review hints and must not block local chain progress."
    ],
    "hardwareRequiredForPrivateTestnet": false,
    "localOnly": true,
    "normalNetworkReconciliationRequired": true
  },
  "chainId": "flowmemory-local-alpha",
  "collections": {
    "alerts": [
      {
        "id": "hw-alert-f187cbc304cb",
        "incidentId": "hw-alert-f187cbc304cb",
        "linkedObjectIds": [
          "fr-e1e7878a2aa8",
          "receipt:hardware:1e92f586a767",
          "challenge:hardware:5f54ef32073d"
        ],
        "localOnly": true,
        "openedAt": "2026-05-13T17:01:30Z",
        "provenance": {
          "capturedAt": "2026-05-13T17:01:40Z",
          "chainContext": "flowchain-private-local-testnet",
          "fixturePath": "fixtures/hardware/flowrouter_local_alpha_seed42.json",
          "localPathHint": "hardware/fixtures/flowrouter_sample_seed42.json",
          "origin": "fixture",
          "subsystem": "hardware"
        },
        "recommendedAction": "check-upstream-and-power",
        "severity": "warning",
        "sourcePacketType": "emergency_offline_signal",
        "status": "unresolved",
        "summary": "Upstream unavailable; LAN dashboard and local cache still reachable.",
        "title": "UPSTREAM_LOSS"
      },
      {
        "id": "hw-alert-008de71ad207",
        "incidentId": "hw-alert-008de71ad207",
        "linkedObjectIds": [
          "bridge-alert:hardware:8662b11ba0d4"
        ],
        "localOnly": true,
        "openedAt": "2026-05-13T17:01:35Z",
        "provenance": {
          "capturedAt": "2026-05-13T17:01:40Z",
          "chainContext": "flowchain-private-local-testnet",
          "fixturePath": "fixtures/hardware/flowrouter_local_alpha_seed42.json",
          "localPathHint": "hardware/fixtures/flowrouter_sample_seed42.json",
          "origin": "fixture",
          "subsystem": "hardware"
        },
        "recommendedAction": "review-bridge-observer-and-do-not-block-chain",
        "severity": "warning",
        "sourcePacketType": "bridge_alert",
        "status": "unresolved",
        "summary": "Bridge observer digest lag detected; local chain continues while operator reviews.",
        "title": "LOCKBOX_OBSERVER_LAG"
      }
    ],
    "artifactCommitments": [
      {
        "artifactId": "artifact:hardware:dffc8c3e46ff",
        "availabilityStatus": "metadata-only",
        "cartridgeId": "cart-0cfd3cfcb210",
        "commitment": "0x7bb78aa4de0935712809a8e46e13b832ba5a761416731e51aeb02d753bbca5b0",
        "containsSecrets": false,
        "expiresAt": "2026-06-13T17:00:00Z",
        "label": "field-test-cache-alpha",
        "localOnly": true,
        "rootfieldId": "rootfield:hardware:flowrouter-local-alpha",
        "sourcePacketType": "nfc_memory_cartridge_metadata",
        "status": "observed",
        "trustLevel": "untrusted-pointer",
        "uriHint": "flowmemory://cache/4549dba629bc"
      }
    ],
    "bridgeAlerts": [
      {
        "alertCode": "LOCKBOX_OBSERVER_LAG",
        "blockHint": 1200024,
        "bridgeAlertId": "bridge-alert:hardware:8662b11ba0d4",
        "bridgeId": "bridge-3489980d98a3",
        "doesNotBlockLocalChain": true,
        "eventDigest": "0xaa5bbd37b946a917cd73aa5394466e71c463cf28e5a1091c474139e23cfe236f",
        "localOnly": true,
        "loraEligible": true,
        "payloadBytesEstimate": 136,
        "provenance": {
          "capturedAt": "2026-05-13T17:01:40Z",
          "chainContext": "flowchain-private-local-testnet",
          "fixturePath": "fixtures/hardware/flowrouter_local_alpha_seed42.json",
          "localPathHint": "hardware/fixtures/flowrouter_sample_seed42.json",
          "origin": "fixture",
          "subsystem": "hardware"
        },
        "recommendedAction": "review-bridge-observer-and-do-not-block-chain",
        "resolutionState": "operator-review-required",
        "rootfieldId": "rootfield:hardware:flowrouter-local-alpha",
        "severity": "warning",
        "sourceChain": "flowchain-local-alpha",
        "sourcePacketType": "bridge_alert",
        "status": "unresolved",
        "subjectId": "lockbox:dfce05f88cae",
        "summary": "Bridge observer digest lag detected; local chain continues while operator reviews.",
        "targetChain": "base-sepolia-sim"
      }
    ],
    "challenges": [
      {
        "challengeId": "challenge:hardware:5f54ef32073d",
        "doesNotExecuteRemoteAction": true,
        "localOnly": true,
        "openedAt": "2026-05-13T17:01:30Z",
        "openedBy": "hardware-node:fr-e1e7878a2aa8",
        "reason": "offline-alert-candidate",
        "receiptId": "receipt:hardware:1e92f586a767",
        "recommendedAction": "check-upstream-and-power",
        "reportId": "report:hardware:bd367723d169",
        "sourcePacketType": "emergency_offline_signal",
        "status": "pending",
        "summary": "Upstream unavailable; LAN dashboard and local cache still reachable.",
        "targetId": "receipt:hardware:1e92f586a767",
        "ttlSeconds": 900
      }
    ],
    "finalityReceipts": [
      {
        "finalityReceiptId": "finality:hardware:e28633303a6b",
        "finalityStatus": "local-pending",
        "localOnly": true,
        "objectId": "receipt:hardware:1e92f586a767",
        "receiptId": "receipt:hardware:1e92f586a767",
        "rootfieldId": "rootfield:hardware:flowrouter-local-alpha",
        "settlement": "local-fixture",
        "sourcePacketType": "compact_receipt_relay",
        "status": "pending"
      }
    ],
    "hardwareNodes": [
      {
        "cacheState": "healthy",
        "callsign": "FlowRouter local-alpha fixture",
        "firmware": "flowrouter.poc.v0",
        "flowcoreState": "online",
        "id": "fr-e1e7878a2aa8",
        "lastHeartbeatAt": "2026-05-13T17:00:10Z",
        "linkedWorkLaneId": "CHECKPOINT_STORAGE",
        "localOnly": true,
        "locationHint": "local lab fixture",
        "nodeId": "fr-e1e7878a2aa8",
        "powerState": "mains",
        "provenance": {
          "capturedAt": "2026-05-13T17:01:40Z",
          "chainContext": "flowchain-private-local-testnet",
          "fixturePath": "fixtures/hardware/flowrouter_local_alpha_seed42.json",
          "localPathHint": "hardware/fixtures/flowrouter_sample_seed42.json",
          "origin": "fixture",
          "subsystem": "hardware"
        },
        "role": "router",
        "sidecarState": "ready",
        "sourcePacketType": "heartbeat",
        "status": "verified",
        "transport": "local-wifi+meshtastic-sidecar-sim",
        "warnings": []
      }
    ],
    "hardwareSignals": [
      {
        "envelopeId": "hw-env-adac8a11bc47",
        "id": "hw-sig-583c993be535",
        "linkedObjectIds": [
          "operator-metadata:hardware:874d3583a3b5"
        ],
        "localOnly": true,
        "loraEligible": false,
        "nodeId": "fr-e1e7878a2aa8",
        "provenance": {
          "capturedAt": "2026-05-13T17:01:40Z",
          "chainContext": "flowchain-private-local-testnet",
          "fixturePath": "fixtures/hardware/flowrouter_local_alpha_seed42.json",
          "localPathHint": "hardware/fixtures/flowrouter_sample_seed42.json",
          "origin": "fixture",
          "subsystem": "hardware"
        },
        "rawEnvelope": {
          "envelopeId": "hw-env-adac8a11bc47",
          "localOnly": true,
          "loraEligible": false,
          "objectRefs": [
            {
              "collection": "operatorMetadata",
              "objectId": "operator-metadata:hardware:874d3583a3b5"
            }
          ],
          "observedAt": "2026-05-13T17:00:00Z",
          "payloadBytesEstimate": 0,
          "provenance": {
            "capturedAt": "2026-05-13T17:01:40Z",
            "chainContext": "flowchain-private-local-testnet",
            "fixturePath": "fixtures/hardware/flowrouter_local_alpha_seed42.json",
            "localPathHint": "hardware/fixtures/flowrouter_sample_seed42.json",
            "origin": "fixture",
            "subsystem": "hardware"
          },
          "schema": "flowmemory.hardware_operator_signal_envelope.local_alpha.v0",
          "signalId": "hw-sig-583c993be535",
          "signalType": "operator_metadata",
          "sourcePacketId": "device_manifest:42",
          "sourcePacketType": "device_manifest",
          "status": "observed"
        },
        "receivedAt": "2026-05-13T17:00:00Z",
        "signalId": "hw-sig-583c993be535",
        "signalType": "operator_metadata",
        "sourcePacketType": "device_manifest",
        "status": "observed",
        "summary": "Local operator metadata for optional hardware fixture ingestion.",
        "transport": "local-simulator"
      },
      {
        "envelopeId": "hw-env-69eab6533abb",
        "id": "hw-sig-cd45a2ab8b1d",
        "linkedObjectIds": [
          "fr-e1e7878a2aa8"
        ],
        "localOnly": true,
        "loraEligible": false,
        "nodeId": "fr-e1e7878a2aa8",
        "provenance": {
          "capturedAt": "2026-05-13T17:01:40Z",
          "chainContext": "flowchain-private-local-testnet",
          "fixturePath": "fixtures/hardware/flowrouter_local_alpha_seed42.json",
          "localPathHint": "hardware/fixtures/flowrouter_sample_seed42.json",
          "origin": "fixture",
          "subsystem": "hardware"
        },
        "rawEnvelope": {
          "envelopeId": "hw-env-69eab6533abb",
          "localOnly": true,
          "loraEligible": false,